No.     Time        Source                Destination           Protocol Source Port Length Sequence number Acknowledgment number Syn        Info
      2 0.023172    128.119.245.12        192.168.1.102         TCP      80          62     883061785       232129013             Set        http > health-polling [SYN, ACK] Seq=883061785 Ack=232129013 Win=5840 Len=0 MSS=1460 SACK_PERM=1
      6 0.053937    128.119.245.12        192.168.1.102         TCP      80          60     883061786       232129578             Not set    http > health-polling [ACK] Seq=883061786 Ack=232129578 Win=6780 Len=0
      9 0.077294    128.119.245.12        192.168.1.102         TCP      80          60     883061786       232131038             Not set    http > health-polling [ACK] Seq=883061786 Ack=232131038 Win=8760 Len=0
     12 0.124085    128.119.245.12        192.168.1.102         TCP      80          60     883061786       232132498             Not set    http > health-polling [ACK] Seq=883061786 Ack=232132498 Win=11680 Len=0
     14 0.169118    128.119.245.12        192.168.1.102         TCP      80          60     883061786       232133958             Not set    http > health-polling [ACK] Seq=883061786 Ack=232133958 Win=14600 Len=0
     15 0.217299    128.119.245.12        192.168.1.102         TCP      80          60     883061786       232135418             Not set    http > health-polling [ACK] Seq=883061786 Ack=232135418 Win=17520 Len=0
     16 0.267802    128.119.245.12        192.168.1.102         TCP      80          60     883061786       232136878             Not set    http > health-polling [ACK] Seq=883061786 Ack=232136878 Win=20440 Len=0
     17 0.304807    128.119.245.12        192.168.1.102         TCP      80          60     883061786       232138025             Not set    http > health-polling [ACK] Seq=883061786 Ack=232138025 Win=23360 Len=0
     24 0.356437    128.119.245.12        192.168.1.102         TCP      80          60     883061786       232139485             Not set    http > health-polling [ACK] Seq=883061786 Ack=232139485 Win=26280 Len=0
     25 0.400164    128.119.245.12        192.168.1.102         TCP      80          60     883061786       232140945             Not set    http > health-polling [ACK] Seq=883061786 Ack=232140945 Win=29200 Len=0
     26 0.448613    128.119.245.12        192.168.1.102         TCP      80          60     883061786       232142405             Not set    http > health-polling [ACK] Seq=883061786 Ack=232142405 Win=32120 Len=0
     27 0.500029    128.119.245.12        192.168.1.102         TCP      80          60     883061786       232143865             Not set    http > health-polling [ACK] Seq=883061786 Ack=232143865 Win=35040 Len=0
     28 0.545052    128.119.245.12        192.168.1.102         TCP      80          60     883061786       232145325             Not set    http > health-polling [ACK] Seq=883061786 Ack=232145325 Win=37960 Len=0
     29 0.576417    128.119.245.12        192.168.1.102         TCP      80          60     883061786       232146217             Not set    http > health-polling [ACK] Seq=883061786 Ack=232146217 Win=37960 Len=0
     36 0.626496    128.119.245.12        192.168.1.102         TCP      80          60     883061786       232147677             Not set    http > health-polling [ACK] Seq=883061786 Ack=232147677 Win=40880 Len=0
     37 0.672796    128.119.245.12        192.168.1.102         TCP      80          60     883061786       232149137             Not set    http > health-polling [ACK] Seq=883061786 Ack=232149137 Win=43800 Len=0
     38 0.730684    128.119.245.12        192.168.1.102         TCP      80          60     883061786       232150597             Not set    http > health-polling [ACK] Seq=883061786 Ack=232150597 Win=46720 Len=0
     39 0.772990    128.119.245.12        192.168.1.102         TCP      80          60     883061786       232152057             Not set    http > health-polling [ACK] Seq=883061786 Ack=232152057 Win=49640 Len=0
     40 0.820622    128.119.245.12        192.168.1.102         TCP      80          60     883061786       232153517             Not set    http > health-polling [ACK] Seq=883061786 Ack=232153517 Win=52560 Len=0
     41 0.853186    128.119.245.12        192.168.1.102         TCP      80          60     883061786       232154409             Not set    http > health-polling [ACK] Seq=883061786 Ack=232154409 Win=52560 Len=0
     48 0.899423    128.119.245.12        192.168.1.102         TCP      80          60     883061786       232155869             Not set    http > health-polling [ACK] Seq=883061786 Ack=232155869 Win=55480 Len=0
     49 0.949545    128.119.245.12        192.168.1.102         TCP      80          60     883061786       232157329             Not set    http > health-polling [ACK] Seq=883061786 Ack=232157329 Win=58400 Len=0
     50 0.994715    128.119.245.12        192.168.1.102         TCP      80          60     883061786       232158789             Not set    http > health-polling [ACK] Seq=883061786 Ack=232158789 Win=61320 Len=0
     51 1.039820    128.119.245.12        192.168.1.102         TCP      80          60     883061786       232160249             Not set    http > health-polling [ACK] Seq=883061786 Ack=232160249 Win=62780 Len=0
     52 1.117097    128.119.245.12        192.168.1.102         TCP      80          60     883061786       232162601             Not set    http > health-polling [ACK] Seq=883061786 Ack=232162601 Win=62780 Len=0
     59 1.200421    128.119.245.12        192.168.1.102         TCP      80          60     883061786       232164061             Not set    http > health-polling [ACK] Seq=883061786 Ack=232164061 Win=62780 Len=0
     60 1.265026    128.119.245.12        192.168.1.102         TCP      80          60     883061786       232166981             Not set    http > health-polling [ACK] Seq=883061786 Ack=232166981 Win=62780 Len=0
     61 1.362074    128.119.245.12        192.168.1.102         TCP      80          60     883061786       232169901             Not set    http > health-polling [ACK] Seq=883061786 Ack=232169901 Win=62780 Len=0
     62 1.389886    128.119.245.12        192.168.1.102         TCP      80          60     883061786       232170793             Not set    http > health-polling [ACK] Seq=883061786 Ack=232170793 Win=62780 Len=0
     69 1.488313    128.119.245.12        192.168.1.102         TCP      80          60     883061786       232173713             Not set    http > health-polling [ACK] Seq=883061786 Ack=232173713 Win=62780 Len=0
     70 1.584980    128.119.245.12        192.168.1.102         TCP      80          60     883061786       232176633             Not set    http > health-polling [ACK] Seq=883061786 Ack=232176633 Win=62780 Len=0
     71 1.661513    128.119.245.12        192.168.1.102         TCP      80          60     883061786       232178985             Not set    http > health-polling [ACK] Seq=883061786 Ack=232178985 Win=62780 Len=0
     78 1.758227    128.119.245.12        192.168.1.102         TCP      80          60     883061786       232181905             Not set    http > health-polling [ACK] Seq=883061786 Ack=232181905 Win=62780 Len=0
     79 1.860063    128.119.245.12        192.168.1.102         TCP      80          60     883061786       232184825             Not set    http > health-polling [ACK] Seq=883061786 Ack=232184825 Win=62780 Len=0
     80 1.930880    128.119.245.12        192.168.1.102         TCP      80          60     883061786       232187177             Not set    http > health-polling [ACK] Seq=883061786 Ack=232187177 Win=62780 Len=0
     87 2.029069    128.119.245.12        192.168.1.102         TCP      80          60     883061786       232190097             Not set    http > health-polling [ACK] Seq=883061786 Ack=232190097 Win=62780 Len=0
     88 2.126682    128.119.245.12        192.168.1.102         TCP      80          60     883061786       232193017             Not set    http > health-polling [ACK] Seq=883061786 Ack=232193017 Win=62780 Len=0
     89 2.203195    128.119.245.12        192.168.1.102         TCP      80          60     883061786       232195369             Not set    http > health-polling [ACK] Seq=883061786 Ack=232195369 Win=62780 Len=0
     96 2.311413    128.119.245.12        192.168.1.102         TCP      80          60     883061786       232198289             Not set    http > health-polling [ACK] Seq=883061786 Ack=232198289 Win=62780 Len=0
     97 2.404228    128.119.245.12        192.168.1.102         TCP      80          60     883061786       232201209             Not set    http > health-polling [ACK] Seq=883061786 Ack=232201209 Win=62780 Len=0
     98 2.476576    128.119.245.12        192.168.1.102         TCP      80          60     883061786       232203561             Not set    http > health-polling [ACK] Seq=883061786 Ack=232203561 Win=62780 Len=0
    105 2.576633    128.119.245.12        192.168.1.102         TCP      80          60     883061786       232206481             Not set    http > health-polling [ACK] Seq=883061786 Ack=232206481 Win=62780 Len=0
    106 2.672045    128.119.245.12        192.168.1.102         TCP      80          60     883061786       232209401             Not set    http > health-polling [ACK] Seq=883061786 Ack=232209401 Win=62780 Len=0
    107 2.747257    128.119.245.12        192.168.1.102         TCP      80          60     883061786       232211753             Not set    http > health-polling [ACK] Seq=883061786 Ack=232211753 Win=62780 Len=0
    114 2.847009    128.119.245.12        192.168.1.102         TCP      80          60     883061786       232214673             Not set    http > health-polling [ACK] Seq=883061786 Ack=232214673 Win=62780 Len=0
    115 2.944420    128.119.245.12        192.168.1.102         TCP      80          60     883061786       232217593             Not set    http > health-polling [ACK] Seq=883061786 Ack=232217593 Win=62780 Len=0
    116 3.020822    128.119.245.12        192.168.1.102         TCP      80          60     883061786       232219945             Not set    http > health-polling [ACK] Seq=883061786 Ack=232219945 Win=62780 Len=0
    123 3.117302    128.119.245.12        192.168.1.102         TCP      80          60     883061786       232222865             Not set    http > health-polling [ACK] Seq=883061786 Ack=232222865 Win=62780 Len=0
    124 3.216127    128.119.245.12        192.168.1.102         TCP      80          60     883061786       232225785             Not set    http > health-polling [ACK] Seq=883061786 Ack=232225785 Win=62780 Len=0
    125 3.291672    128.119.245.12        192.168.1.102         TCP      80          60     883061786       232228137             Not set    http > health-polling [ACK] Seq=883061786 Ack=232228137 Win=62780 Len=0
    132 3.388926    128.119.245.12        192.168.1.102         TCP      80          60     883061786       232231057             Not set    http > health-polling [ACK] Seq=883061786 Ack=232231057 Win=62780 Len=0
    133 3.485275    128.119.245.12        192.168.1.102         TCP      80          60     883061786       232233977             Not set    http > health-polling [ACK] Seq=883061786 Ack=232233977 Win=62780 Len=0
    134 3.562531    128.119.245.12        192.168.1.102         TCP      80          60     883061786       232236329             Not set    http > health-polling [ACK] Seq=883061786 Ack=232236329 Win=62780 Len=0
    141 3.660330    128.119.245.12        192.168.1.102         TCP      80          60     883061786       232239249             Not set    http > health-polling [ACK] Seq=883061786 Ack=232239249 Win=62780 Len=0
    142 3.768417    128.119.245.12        192.168.1.102         TCP      80          60     883061786       232242169             Not set    http > health-polling [ACK] Seq=883061786 Ack=232242169 Win=62780 Len=0
    143 3.840483    128.119.245.12        192.168.1.102         TCP      80          60     883061786       232244521             Not set    http > health-polling [ACK] Seq=883061786 Ack=232244521 Win=62780 Len=0
    150 3.936967    128.119.245.12        192.168.1.102         TCP      80          60     883061786       232247441             Not set    http > health-polling [ACK] Seq=883061786 Ack=232247441 Win=62780 Len=0
    151 4.031145    128.119.245.12        192.168.1.102         TCP      80          60     883061786       232250361             Not set    http > health-polling [ACK] Seq=883061786 Ack=232250361 Win=62780 Len=0
    152 4.107455    128.119.245.12        192.168.1.102         TCP      80          60     883061786       232252713             Not set    http > health-polling [ACK] Seq=883061786 Ack=232252713 Win=62780 Len=0
    159 4.205521    128.119.245.12        192.168.1.102         TCP      80          60     883061786       232255633             Not set    http > health-polling [ACK] Seq=883061786 Ack=232255633 Win=62780 Len=0
    160 4.300300    128.119.245.12        192.168.1.102         TCP      80          60     883061786       232258553             Not set    http > health-polling [ACK] Seq=883061786 Ack=232258553 Win=62780 Len=0
    161 4.379826    128.119.245.12        192.168.1.102         TCP      80          60     883061786       232260905             Not set    http > health-polling [ACK] Seq=883061786 Ack=232260905 Win=62780 Len=0
    168 4.476833    128.119.245.12        192.168.1.102         TCP      80          60     883061786       232263825             Not set    http > health-polling [ACK] Seq=883061786 Ack=232263825 Win=62780 Len=0
    169 4.575928    128.119.245.12        192.168.1.102         TCP      80          60     883061786       232266745             Not set    http > health-polling [ACK] Seq=883061786 Ack=232266745 Win=62780 Len=0
    170 4.648167    128.119.245.12        192.168.1.102         TCP      80          60     883061786       232269097             Not set    http > health-polling [ACK] Seq=883061786 Ack=232269097 Win=62780 Len=0
    177 4.747988    128.119.245.12        192.168.1.102         TCP      80          60     883061786       232272017             Not set    http > health-polling [ACK] Seq=883061786 Ack=232272017 Win=62780 Len=0
    178 4.844598    128.119.245.12        192.168.1.102         TCP      80          60     883061786       232274937             Not set    http > health-polling [ACK] Seq=883061786 Ack=232274937 Win=62780 Len=0
    179 4.920051    128.119.245.12        192.168.1.102         TCP      80          60     883061786       232277289             Not set    http > health-polling [ACK] Seq=883061786 Ack=232277289 Win=62780 Len=0
    186 5.019189    128.119.245.12        192.168.1.102         TCP      80          60     883061786       232280209             Not set    http > health-polling [ACK] Seq=883061786 Ack=232280209 Win=62780 Len=0
    190 5.125019    128.119.245.12        192.168.1.102         TCP      80          60     883061786       232283129             Not set    http > health-polling [ACK] Seq=883061786 Ack=232283129 Win=62780 Len=0
    191 5.197286    128.119.245.12        192.168.1.102         TCP      80          60     883061786       232285481             Not set    http > health-polling [ACK] Seq=883061786 Ack=232285481 Win=62780 Len=0
    198 5.297257    128.119.245.12        192.168.1.102         TCP      80          60     883061786       232288401             Not set    http > health-polling [ACK] Seq=883061786 Ack=232288401 Win=62780 Len=0
    200 5.389471    128.119.245.12        192.168.1.102         TCP      80          60     883061786       232291321             Not set    http > health-polling [ACK] Seq=883061786 Ack=232291321 Win=62780 Len=0
    201 5.447887    128.119.245.12        192.168.1.102         TCP      80          60     883061786       232293053             Not set    http > health-polling [ACK] Seq=883061786 Ack=232293053 Win=62780 Len=0
    202 5.455830    128.119.245.12        192.168.1.102         TCP      80          60     883061786       232293103             Not set    http > health-polling [ACK] Seq=883061786 Ack=232293103 Win=62780 Len=0
    203 5.461175    128.119.245.12        192.168.1.102         HTTP     80          784    883061786       232293103             Not set    HTTP/1.1 200 OK  (text/html)
